{
  "$schema": "http://json-schema.org/draft-07/schema#",
  "$id": "http://example.com/schemas/compoundrecord.json",
  "$comment": "Draft 02 - definining properties of objects. Requires additional specficitions of required fields.",
  "title": "Compound Record for NP-MRD consortium",
  "description": "A comprehensive data record for the NP-MRD consortium including extended analytical data records.",
  "type": "object",
  "properties": {
    "name": { "type": "string" },
    "smiles": { "type": "string" },
    "origin_doi": {
      "type": "string",
      "pattern": "^10.\\d{4,9}/[-._;()/:A-Za-z0-9]+$"
    },
    "origin_type": { "type": "string" },
    "origin_genus": { "type": "string" },
    "origin_species": { "type": "string" },
    "optical_rotation": {
      "type": "object",
      "properties": {
        "temperature": { "type": "number" },
        "reference": { "type": "string" },
        "value": { "type": "number" },
        "concentration": { "type": "number" },
        "solvent": { "type": "string" }
      },
      "required": []
    },
    "uv_spectroscopy": {
      "type": "object",
      "properties": {
        "solvent": { "type": "string" },
        "units": { "type": "string" },
        "spectrum": {
          "type": "array",
          "items": {
            "type": "object",
            "properties": {
              "wavelength": { "type": "number" },
              "absorptivity": { "type": "number" }
            }
          }
        }
      },
      "required": []
    },
    "ir_spectroscopy": {
      "type": "object",
      "solvent": { "type": "string" },
      "units": { "type": "string" },
      "spectrum": {
        "type": "array",
        "items": { "type": "number" }
      },
      "required": []
    },
    "h_nmr": {
      "type": "object",
      "properties": {
        "solvent": { "type": "string" },
        "temperature": { "type": "number" },
        "reference": { "type": "string" },
        "spectrum": {
          "type": "array",
          "items": {
            "type": "object",
            "properties": {
              "shift": { "type": "number" },
              "integration": { "type": "number" },
              "multiplicty": { "type": "string" },
              "coupling": { "type": "array", "items": { "type": "number" } },
              "atom_index": { "type": "string" },
              "rdkit_index": { "type": "string" }
            },
            "required": []
          }
        },
        "ambiguous": { "type": "array", "items": { "type": "string" } }
      },
      "required": []
    },
    "c_nmr": {
      "type": "object",
      "properties": {
        "solvent": { "type": "string" },
        "temperature": { "type": "number" },
        "reference": { "type": "string" },
        "spectrum": {
          "type": "array",
          "items": {
            "type": "object",
            "properties": {
              "shift": { "type": "number" },
              "atom_index": { "type": "string" },
              "rdkit_index": { "type": "string" }
            },
            "required": []
          }
        },
        "ambiguous": { "type": "array", "items": { "type": "string" } }
      },
      "required": []
    }
  },
  "required": []
}
